{"$schema":"https://json-schema.org/draft/2020-12/schema","$id":"https://aese.local/schemas/capability-build-campaign.schema.json","type":"object","additionalProperties":false,"required":["schema_version","campaign","world_run_id","timezone","policy_version","m10_terminal_hash","options","frames"],"properties":{"schema_version":{"const":"1.0"},"campaign":{"const":"capability-build"},"world_run_id":{"type":"string","minLength":1},"timezone":{"const":"Asia/Shanghai"},"policy_version":{"const":"capability-build-policy-v1"},"m10_terminal_hash":{"type":"string","pattern":"^sha256:"},"options":{"type":"array","minItems":3},"frames":{"type":"array","minItems":10,"items":{"type":"object"}}}}
